title,link,date
Roundup: China's support important for economic globalization -- British experts,https://english.news.cn/20240317/0df8bb04414945f89c81ca58830530a6/c.html,2024-03-17 18:42:15
Feature: ROK entrepreneur enthralled by rural China's vitality,https://english.news.cn/20240315/0ec82a3cef694438983c4eb82ff50f60/c.html,2024-03-15 21:31:00
"Economic Watch: Industry insiders upbeat about seafood trade between U.S., China despite multiple uncertainties",https://english.news.cn/20240315/9572e9c09d2b48ff8b0c5fc9d739bd6c/c.html,2024-03-15 13:58:17
"Interview: ""Biggest risk is not being in China,"" says German Chamber of Commerce executive in Shanghai",https://english.news.cn/20240315/629b07984ea549b1bd5825ef9dc377a7/c.html,2024-03-15 13:58:18
"Interview: Angola ready to work with China to boost economic development, says business leader",https://english.news.cn/20240315/5934d7d0420c4f9c9a058edb1dc23b8b/c.html,2024-03-15 14:02:45
"Interview: IMF's upward revision of China's economic growth positive for global economic recovery, says former Pakistani minister",https://english.news.cn/20240314/19dc0a8cfe1d4ab6a90fa9ba7824c1d3/c.html,2024-03-14 18:53:30
Guest Opinion: Robust growth of Chinese economy will contribute to the development of Africa and global economy,https://english.news.cn/20240314/d714e1cac209402790facfad6dca4b67/c.html,2024-03-14 14:07:00
"Interview: China on track to achieve objectives, says U.S. scholar",https://english.news.cn/20240314/47d00f8282204d9e8554d23e855c5f03/c.html,2024-03-14 14:05:30
"Xinhua Commentary: ""China card"" no cure for America's ills",https://english.news.cn/20240313/0cbdc1f317ba41b494b9964289ffd7ee/c.html,2024-03-13 13:12:15
Xinhua Commentary: China's proactive opening up expands mutual dividends,https://english.news.cn/20240312/a080464e98ea413985e89c86dc627f2c/c.html,2024-03-12 17:28:15
"Interview: China's green growth leads global green transition, says Ethiopian expert",https://english.news.cn/20240312/2c2f84af667d4f6eb9df3cf204a13430/c.html,2024-03-12 13:15:45
"Chinese ambassador sees win-win cooperation as right choice for China, Australia to tackle global challenges",https://english.news.cn/20240311/a48de449b3d24c3e8ddbea76f3e5bfe2/c.html,2024-03-11 19:29:00
"Interview: Innovation to drive China's high-quality economic growth, says Ghanaian media executive",https://english.news.cn/20240311/114864fd6c7d4e5fa2cda461ab97f1ae/c.html,2024-03-11 13:28:15
Interview: Chinese modernization has broad applicability in developing world: Russian scholar,https://english.news.cn/20240311/d992fc7e2e6f4eacaec47534f12befd5/c.html,2024-03-11 12:15:15
Feature: Palestinians in Gaza observe joyless Ramadan under shadow of bloodshed,https://english.news.cn/20240311/2efcc12e48a0436ca640f76423a60d6f/c.html,2024-03-11 07:15:30
"Interview: China offers innumerable opportunities, says DHL Express CEO",https://english.news.cn/20240310/3876b40099974537859e73ebc2e119ab/c.html,2024-03-10 18:23:30
"Guest Opinion: Navigating China's economic evolution -- Insights from China's ""two sessions""",https://english.news.cn/20240310/86ec37a50e8b401a82698792b0d5bece/c.html,2024-03-10 18:02:30
Economic Watch: Foreign companies take root in east China,https://english.news.cn/20240310/4ca5333214aa4884ace92176ca618436/c.html,2024-03-10 14:28:00
Xinhua Commentary: China-Europe rail route stabilizes global supply chains amid turmoil,https://english.news.cn/20240309/15c342f7619c488086845a8fd89c31dc/c.html,2024-03-09 20:01:00
"Explainer: Why Chinese modernization a buzzword during China's ""two sessions""?",https://english.news.cn/20240309/59aec541460f487788850822eb8d1624/c.html,2024-03-09 20:00:15
Interview: UN Women's deputy chief urges action to invest in women for societal progress,https://english.news.cn/20240309/d93a4e4a7e314b648fbda9c78b94b4d0/c.html,2024-03-09 18:58:30
Xinhua Commentary: Xizang experiencing its best period of development,https://english.news.cn/20240309/908a619bb225490a9e9b766c843bf287/c.html,2024-03-09 15:52:30
"Interview: Impossible to isolate China, says Croatian expert",https://english.news.cn/20240309/301ab25866254a339d211db0410077e5/c.html,2024-03-09 15:48:00
"Xinhua Commentary: Chinese economy ascending, not peaking",https://english.news.cn/20240308/cb20d15706304b0a8d24bccfd0166d5d/c.html,2024-03-08 21:54:34
"Xinhua Commentary: What is behind the ""China shock"" concoction",https://english.news.cn/20240308/8658203b864347eb83bf7ddf8887a7a6/c.html,2024-03-08 18:44:30
Interview: China's high-quality development contributes to global energy transition-- Brazilian mining giant,https://english.news.cn/20240308/bc69320ee8734058bf5892a23e23531f/c.html,2024-03-08 15:54:00
Feature: China's Juncao technology improves livelihood of women in Central African Republic,https://english.news.cn/20240308/bba432e769444429b0c70bad90ff2a76/c.html,2024-03-08 11:13:00
"Interview: ""China speed"" encourages Decathlon China to ""speed up,"" says VP",https://english.news.cn/20240308/f0ee92745f774db9bf1fbb35525ac08b/c.html,2024-03-08 10:14:31
Xinhua Commentary: U.S. protectionist tricks fool no one,https://english.news.cn/20240306/07e338edf88d4c9982c3c8ad365bb4b9/c.html,2024-03-06 22:10:45
Xinhua Commentary: U.S. obsession with hegemony runs counter to global trend,https://english.news.cn/20240306/3eb8831819564b3eb27b961daac17d06/c.html,2024-03-06 16:50:30
"Guest Opinion: ""Two sessions"" will pave way for China in an increasingly uncertain world",https://english.news.cn/20240306/f4a403c6aab14e62a9dd4ccc08fbe79a/c.html,2024-03-06 15:04:15
Economic Watch: Zooming into China's super-large market,https://english.news.cn/20240304/b6e8916fdea442d5894f0bafc4ac3379/c.html,2024-03-04 19:45:15
Xinhua Commentary: People's democracy -- a glimpse into China's unique approach,https://english.news.cn/20240304/ac36af177f644bafa362873ab7a82f90/c.html,2024-03-04 15:25:45
"Chinese market vital for U.S. companies seeking global competitiveness, U.S. business leaders say",https://english.news.cn/20240304/4d5bbe0c7f6a40b9b014b25ab4d70bad/c.html,2024-03-04 13:10:00
"Xinhua Commentary: China navigates economic challenges with innovative, synergistic policy strength",https://english.news.cn/20240301/e427871f84af458cbd676d8a8907e92a/c.html,2024-03-01 20:51:30
Xinhua Commentary: Solid public consensus lays foundation for early HKSAR Basic Law Article 23 legislation,https://english.news.cn/20240301/65b99a86d094479493693994af035da6/c.html,2024-03-01 20:47:00
Interview: Olympic champion Su embracing passion for snow sports in Saudi Arabia,https://english.news.cn/20240228/debb40358393456dae800c4aed2b823b/c.html,2024-02-28 16:32:45
"China leads world in calling for global cooperation, says British business leader",https://english.news.cn/20240228/3902b6d94f56461988f8ec8b86d3d676/c.html,2024-02-28 14:57:15
Economic Watch: Chinese cosmetics take Southeast Asian beauty economy by storm,https://english.news.cn/20240228/bfdd650d70d14abe88ae3d2dd5fbc1d9/c.html,2024-02-28 14:13:15
"Interview: China achieves comprehensive development, fruitful Belt and Road cooperation, says Egyptian expert",https://english.news.cn/20240228/e2a94537dd324250a40d36cd24e90153/c.html,2024-02-28 11:26:45
Guest Opinion: The Global Security Initiative -- China's way forward in a turbulent world,https://english.news.cn/20240227/4094c4b11c99428aaeb7384cf53527fa/c.html,2024-02-27 17:09:45
Interview: Chinese economy remains a global pillar -- Zambian expert,https://english.news.cn/20240226/d4c3f97622b64bd09f88e5318b7b07b6/c.html,2024-02-26 09:05:15
"Xinhua Commentary: ""Next China"" to overshadow ""Peak China"" in unfolding reality",https://english.news.cn/20240224/4d9ab8c98f31431da280d2c8426649e3/c.html,2024-02-24 15:45:30
"Interview: Mutual respect, cooperation key to unfading bilateral ties with China: Antigua and Barbuda PM",https://english.news.cn/20240224/0e11d5b0772d46f7af3683f018e7b25b/c.html,2024-02-24 12:09:45
"Guest Opinion: Trump a symptom, not cause of U.S. polarization",https://english.news.cn/20240223/825c52c5707949fa8dfadb3fe5cd2c83/c.html,2024-02-23 21:08:16
"Xinhua Commentary: With int'l debut, China's C919 offers a paradigm of worldwide collaboration",https://english.news.cn/20240222/c00c5e9f0ee64acc8eb01135145d859b/c.html,2024-02-22 20:49:00
World Insights: Arab states condemn U.S. for vetoing UNSC resolution on Gaza ceasefire,https://english.news.cn/20240222/d302a3276bf54c73ae94f7caff579d4c/c.html,2024-02-22 13:48:00
"Xinhua Commentary: China a go-getter, helper in carbon cut",https://english.news.cn/20240221/9fd2c9370383479f84dfca6e0aa8500f/c.html,2024-02-21 21:00:00
Quick View: Washington's ruthless zero-sum appetite spells trouble for the world,https://english.news.cn/20240221/b1687594dfac42b5854a8d03df9e2487/c.html,2024-02-21 18:28:16
"Explainer: What do ""new productive forces"" mean?",https://english.news.cn/20240221/4c55dcbd41404f92a96a8917f927f8eb/c.html,2024-02-21 15:53:30
Interview: The West needs to learn from China's win-win approach: former UN official,https://english.news.cn/20240220/16eb301bee1d44328d817eaaaf305bf8/c.html,2024-02-20 16:07:16
Interview: Expert says China's economic development people-oriented,https://english.news.cn/20240220/7afe641897f94947b12c961b929e1b60/c.html,2024-02-20 12:42:30
Interview: Multilateralism essential to solving global problems: World Bank senior official,https://english.news.cn/20240220/cbf92513abbf40009abed21e3c819ca6/c.html,2024-02-20 08:51:15
World Insights: Transatlantic discordance emerges over Gaza conflict,https://english.news.cn/20240219/1cd4538b58d74ebdab3b55de6c8cce42/c.html,2024-02-19 15:26:30
Xinhua Commentary: How to avoid lose-lose? True multilateralism gives answer,https://english.news.cn/20240217/ab83f26be79b4d479129b7cd956227f2/c.html,2024-02-17 14:57:30
Economic Watch: Why Japan slips into recession and loses crown as world's third-largest economy?,https://english.news.cn/20240216/b2f55badc3f948388f8ecd1fa45f5964/c.html,2024-02-16 13:18:00
"Feature: Overseas Chinese northeasterner proudly spreads food, culture in Australia",https://english.news.cn/20240214/1db481cfac1f49b48b00eb98162cc5a4/c.html,2024-02-14 13:41:30
Feature: Spring Festival celebrations bring Spaniards closer to China and its culture,https://english.news.cn/20240214/22654ac92fcb4fec988b5826ee1f2e40/c.html,2024-02-14 09:57:00
World Insights: Pyromaniac U.S. poses as fireman in the Middle East,https://english.news.cn/20240213/c915ebd423fe496f8a86f28262d49105/c.html,2024-02-13 16:00:31
"Interview: Recovery of Chinese tourists to Italy to reach ""new peaks"" in new year, says tourism official",https://english.news.cn/20240212/ec8b2536f4644e7fb4e8eb6850ee01ba/c.html,2024-02-12 11:56:30
"Xinhua Headlines: In Harbin's icy embrace, tourists flock to offer condolences, cherish memories",https://english.news.cn/20240208/c107dd7acb264e28bd8adfa010b162e2/c.html,2024-02-08 22:08:31
"World Insights: U.S. experts urge courage, strength in U.S.-China relations",https://english.news.cn/20240207/93ed28ef6d984558a244c72fda97ca8d/c.html,2024-02-07 16:32:00
"World Insights: Global forum on AI addresses ethics, sovereignty concerns",https://english.news.cn/20240207/058e35a101fd446c95cc3017de6d5ea4/c.html,2024-02-07 16:09:30
Interview: KPMG eyes broad prospects for China's new productive forces,https://english.news.cn/20240207/cfb7c7343a5f490b80ab60f0546f6696/c.html,2024-02-07 09:40:00
"Xinhua Commentary: To understand China's economy, come to China",https://english.news.cn/20240206/f73e7c3f8b6d478bb50a5573617b37b6/c.html,2024-02-06 20:33:45
Xinhua Commentary: U.S. attempt to stonewall China-PNG security cooperation completely unwarranted,https://english.news.cn/20240205/126038c16e3a48acb14f2876050512d0/c.html,2024-02-05 20:27:45
Economic Watch: Beijing-Tianjin-Hebei region's coordinated development fosters growth momentum,https://english.news.cn/20240205/c08380febbbe442a95f7f53b5fdac5e6/c.html,2024-02-05 12:09:45
"World Insights: Uncle Sam's war business, dance of power and profit",https://english.news.cn/20240205/dca95b19efe848af908168a95527c7c0/c.html,2024-02-05 11:34:30
Feature: Happy Chinese New Year Beach Carnival shines at New Zealand beach,https://english.news.cn/20240205/973034b8ccb949ca833d744b0acb216a/c.html,2024-02-05 09:23:45
Xinhua Commentary: Deepening people-to-people exchanges strengthen China-ASEAN bonds,https://english.news.cn/20240204/e50a8238eada4546af8150d290c28bcf/c.html,2024-02-04 16:12:00
"Explainer: What to expect from AU summit as education, development take center stage",https://english.news.cn/20240217/280b3c25104b4ac196029dca0826da21/c.html,2024-02-17 10:39:30
"Feature: China's libraries go smarter to stock more books, engage more readers",https://english.news.cn/20240204/ee5e2ef2b95b40f5a5723e79cb7c8127/c.html,2024-02-04 14:43:45
Xinhua Commentary: Making America alone again,https://english.news.cn/20240203/94b7a45b43b04f77893328ee8db8cf2c/c.html,2024-02-03 20:33:30
"Interview: Global inflation progress ""could be reversed"" amid Red Sea tensions: IMF official",https://english.news.cn/20240202/5db16efaca1f4433aea164dfbfe8cf48/c.html,2024-02-02 10:59:30
"Interview: Chinese collaboration boosts Brazil's EV industry, says business leader",https://english.news.cn/20240201/ab58dd9ad69640729c8ded18977fcbb4/c.html,2024-02-01 22:17:00
Economic Watch: Europe's economic recovery momentum remains dented,https://english.news.cn/20240131/3f869c984410413894419bd4e6d25f7c/c.html,2024-01-31 12:09:45
Opinion: Why people-to-people exchanges between China and the U.S. are a precious asset,https://english.news.cn/20240130/b1c06feb4fe643c18251f0fcfa14f480/c.html,2024-01-30 21:47:45
"Interview: Sudan's deepening hunger crisis requires immediate, collective action, says FAO senior official",https://english.news.cn/20240129/bc8ad899291d4305b659995dfd0cb198/c.html,2024-01-29 20:56:15
Feature: Winter sports fervor spurs ice-and-snow consumption in NW China,https://english.news.cn/20240129/10d08fb3964c42dcafbbe0fb589361c2/c.html,2024-01-29 09:30:16
Opinion: Xavi's departure a reflection of deep problems at Barcelona,https://english.news.cn/20240128/679418d9861b429ca08c2b5eb6a7906d/c.html,2024-01-28 20:11:00
Economic Watch: Foreign-funded banks upbeat about China's economic development,https://english.news.cn/20240128/42aa26125c8945929e1dccff0aef338d/c.html,2024-01-28 13:58:45
"Xinhua Commentary: China's local ""two sessions"" convey confidence in 2024 economy",https://english.news.cn/20240127/a3ddca80727c4a0f9e9c81296d04e089/c.html,2024-01-27 21:37:15
Guest Opinion: China's economic miracle continues,https://english.news.cn/20240127/ff1118a6d49c442db8e88699b2651b78/c.html,2024-01-27 20:02:15
"Xinhua Commentary: China, a pioneer in enriching global human rights practice",https://english.news.cn/20240127/bc8ab8265fe54f2c9d768d9afcc5b364/c.html,2024-01-27 20:00:45
"Interview: 60th anniversary of diplomatic ties to strengthen China-France relations, says friendship group president",https://english.news.cn/20240127/e85f60b6a2324cca9ebc25292563c193/c.html,2024-01-27 17:27:00
"Interview: France, China committed to growing ties from global perspective, says former French PM",https://english.news.cn/20240127/0223a85627a640fca41692a0859af18f/c.html,2024-01-27 13:29:00
"Xinhua Commentary: West's fear of ""Chinese hegemony"" stems from its own brutal history",https://english.news.cn/20240127/6392417fd8eb45d8986a337b6e4b03f2/c.html,2024-01-27 13:28:00
World Insights: China's nuclear power collaboration with France remains promising four decades later,https://english.news.cn/20240127/f00daa140c6446b5a1c98d54118e83c0/c.html,2024-01-27 10:40:30
Economic Watch: Streamlined gov't services boost economic vitality in Beijing,https://english.news.cn/20240126/9a6dd5dd4fbf4ce1bdad2c6b9e777ca5/c.html,2024-01-26 14:54:30
Feature: A lesser-known story of helping hands in developing China's winter sports,https://english.news.cn/20240126/d38373be03774ef2a15ddc4da14d919c/c.html,2024-01-26 08:57:00
Xinhua Commentary: Lies about China reveal Western hypocrisy,https://english.news.cn/20240125/a4e41706d6a04e6ea77fef38fd0b6257/c.html,2024-01-25 14:44:15
"Cutting off ties to Chinese tech, talent hurts America: opinion piece",https://english.news.cn/20240124/ca391ac32ce94dec84651c341b86e578/c.html,2024-01-24 22:16:45
Interview: China to build an investor-centered capital market -- securities watchdog,https://english.news.cn/20240124/0ea7b5a989344c918d1f9e6e9eebea30/c.html,2024-01-24 20:03:15
"China makes remarkable progress in protecting children's rights, experts say",https://english.news.cn/20240124/6469f73e41f046f5b1a08378f263b08c/c.html,2024-01-24 18:52:00
"Interview: Primavera Capital CEO refutes narratives calling China ""uninvestable""",https://english.news.cn/20240124/170d59b8fcfe4655877989a6f0c977f3/c.html,2024-01-24 14:03:00
"Interview: China's human rights achievements widely acclaimed, says ambassador",https://english.news.cn/20240124/d25c2c208c2b4abd849c045278b3309b/c.html,2024-01-24 06:57:45
"Interview: China key partner of G77 nations in global affairs, says S. African minister",https://english.news.cn/20240122/3bc4caec03ef443da3376d096c19ecf1/c.html,2024-01-22 17:32:15
"World Insights: With record sales, Chinese automakers win Russian market",https://english.news.cn/20240122/e2bda940b0c14a8682903bc7162a0f88/c.html,2024-01-22 15:51:01
Interview: WTO chief says Chinese economy to help boost global growth,https://english.news.cn/20240120/bce6f4158abb4a7898f053fc597d210c/c.html,2024-01-20 13:38:30
"Interview: Regional trade agreement provides powerful organisational framework for economic growth, says Australian business leader",https://english.news.cn/20240120/1b45a023bf0c4af9a3415c4c4ee98ac5/c.html,2024-01-20 13:28:45
"Five factors to affect Russia-Ukraine conflict in 2024, says expert",https://english.news.cn/20240119/337533a416494ba2b95e03d4eabd638e/c.html,2024-01-19 17:53:17
Expert predicts four major trends of U.S. global strategy in 2024,https://english.news.cn/20240119/052f12466f0143b3845822a005731f69/c.html,2024-01-19 17:52:32
Economic Watch: China's NEV market accelerates toward intelligent driving,https://english.news.cn/20240119/e26d79a577644724911057530c9b1743/c.html,2024-01-19 13:24:15
Explainer: China emits fresh signals on building a financial powerhouse,https://english.news.cn/20240118/0be59c871d9f4a0e9d261f9f1093af10/c.html,2024-01-18 19:16:45
Interview: Int'l Energy Agency chief regards China as world champion in green energy,https://english.news.cn/20240118/5f1f9bfef1fb41dfaaa8779b94466638/c.html,2024-01-18 18:13:30
"Interview: Int'l collaboration needed to keep earth habitable, says climate scientist",https://english.news.cn/20240118/d8377048908f4c22855e8bfb86ddb435/c.html,2024-01-18 17:09:00
ASEAN secretary-general speaks highly of China's economy,https://english.news.cn/20240117/7a433dde0f9a411095ab5c05a71954ae/c.html,2024-01-17 21:30:15
"Xinhua Commentary: Embracing China brings opportunity, not risk",https://english.news.cn/20240117/0e864f608e7342f298d441275a586e5d/c.html,2024-01-17 21:08:45
Xinhua Commentary: Chinese FM's visit to Africa highlights deep-rooted friendship,https://english.news.cn/20240117/c387c54005ff46e0aae9de8fdd53ff8b/c.html,2024-01-17 20:49:30
Xinhua Commentary: China's economy to further recover despite challenges,https://english.news.cn/20240117/f8bc0f9c9c204f268fef9ffa7c9db7a9/c.html,2024-01-17 17:27:15
"Interview: U.S., China need not be each other's ""major problem,"" says U.S. scholar",https://english.news.cn/20240116/96dd235870974b2b8318942ac86edfef/c.html,2024-01-16 22:04:45
Xinhua Commentary: Nauru's decision to uphold one-China principle in line with trend of the times,https://english.news.cn/20240116/3a37b5b9043747049c94307614fe6a60/c.html,2024-01-16 20:53:45
"Xinhua Commentary: To renew China-U.S. sci-tech pact benefits both, world",https://english.news.cn/20240116/f7ac89cbdb2a456997717f4491a7424a/c.html,2024-01-16 20:47:15
Talking Down the Chinese Economy Does No Good to the World,https://english.news.cn/20240116/3e5efec2037b49f7b842c18e952c6698/c.html,2024-01-16 19:10:59
"Feature: Sports boom showcases China's vitality, prosperity",https://english.news.cn/20240116/536b2855f268434b8c3f5a12755219a0/c.html,2024-01-16 11:24:45
Feature: Winter sports heat up winter tourism in NW China,https://english.news.cn/20240116/3cdfc31c09a74000bcbd598d133a8adb/c.html,2024-01-16 11:06:15
"Xinhua Commentary: China, Europe reach out to each other in icy winter",https://english.news.cn/20240115/050e4397721a4da2a1ac1586fcfea2e7/c.html,2024-01-15 19:03:00
Feature: Gazan patients in dire need of medical care as conflict reaches grim milestone,https://english.news.cn/20240115/b3d5aa29ab90407ca5a8ff80b4516dee/c.html,2024-01-15 07:30:15
"Xinhua Commentary: Chinese premier travels to Europe to boost ties, globalization in 2024's first overseas trip",https://english.news.cn/20240114/e3a20e30c58d4e3198ea7b5823196375/c.html,2024-01-14 16:39:15
"Explainer: How U.S. ""de-risking"" from China poses heightened risks to global supply chains?",https://english.news.cn/20240113/4153165f90a646dfb417cc43ee4f355f/c.html,2024-01-13 21:56:45
Guest Opinion: Let the universal human rights be what they should be -- on the 75th anniversary of the Universal Declaration of Human Rights,https://english.news.cn/20240113/3ce169f02c6b4b5d85bb96ba7e3af4bf/c.html,2024-01-13 17:24:15
"Economic Watch: Italy's top art school expands presence in China, boosting Shenzhen's fashion industry",https://english.news.cn/20240113/af1c81bec4de4ac08155c4542db8ca8d/c.html,2024-01-13 10:43:45
Explainer: How the global election year might shape world politics,https://english.news.cn/20240112/6a5effcdcbd64534b60524af3f99b616/c.html,2024-01-12 21:42:45
"Guest Opinion: Forging new bridges of understanding between U.S., China",https://english.news.cn/20240112/2c6dd628ad14480c84dd4033d11cd29a/c.html,2024-01-12 21:25:30
"Across China: Sand-ravaged city reaps economic, ecological benefits from green power generation",https://english.news.cn/20240112/16cc520925394f3e91d98a9ce74cc987/c.html,2024-01-12 19:59:45
"Interview: New productive forces to boost high-quality development, says expert",https://english.news.cn/20240111/2126a14ec41b40b782a17c9e4e91bdb8/c.html,2024-01-11 16:23:30
World Insights: Why multinational companies are quitting India,https://english.news.cn/20240110/42c160d295cd4a2c92906737a3374693/c.html,2024-01-10 18:08:15
"Feature: How a Chinese youth becomes ""Cun Chao"" Golden Boot receiver",https://english.news.cn/20240110/6981f4af049a4116987e4f2772ee74fa/c.html,2024-01-10 08:30:00
"Xinhua Commentary: RCEP fuels regional growth amid economic recovery, challenges",https://english.news.cn/20240109/cf60b46748e640f99ab85e0847a61c95/c.html,2024-01-09 20:12:30
"Interview: China is a key player in global affairs, says expert",https://english.news.cn/20240109/70266b1877484d7ea46a64d5543618ca/c.html,2024-01-09 10:55:30
"World Insights: Japan's Noto quakes fuel nuclear safety concern, reignite anti-nuclear sentiment",https://english.news.cn/20240109/85b9f00d2e2d42c68f87122bc0080672/c.html,2024-01-09 10:02:15
"Economic Watch: Eyeing vast opportunities, multinationals flock to China",https://english.news.cn/20240108/c93a2091820b43dd97c00f6610b39309/c.html,2024-01-08 11:02:45
Feature: China's outdoor sports boom driving business growth,https://english.news.cn/20240105/8f125bec05974854abe9e82523d1c74a/c.html,2024-01-05 10:46:45
"Fact Check: ""Iron Army"" does not equal ""Wolf Warrior Diplomacy""",https://english.news.cn/20240104/68f0ba940a6d4e59be4c795285a0b9db/c.html,2024-01-04 18:07:30
Interview: Challenges and opportunities for New Zealand SMEs in Chinese e-commerce landscape: experts,https://english.news.cn/20240102/a79a3a3759ad404dafc3dc246ea2e88b/c.html,2024-01-02 18:11:45
Xinhua Commentary: China-U.S. diplomatic ties need recalibration after 45 years,https://english.news.cn/20240101/774935fbfd3c4d8ea99896d49e5f5594/c.html,2024-01-01 22:09:30
"Xinhua Commentary: Opportune moment for China, U.S. to chart steady course forward",https://english.news.cn/20240101/9d75e03b41084991a4be0e41717433d7/c.html,2024-01-01 17:41:00
"Interview: China's development success a great opportunity for world economy, says expert",https://english.news.cn/20240101/b6e8450f1bef4df590a59d1be1108c9e/c.html,2024-01-01 14:57:15
Yearender: Global upheavals and renewal -- a review of 2023,https://english.news.cn/20231231/77a831a460574d8c8406d1ce2154caf5/c.html,2023-12-31 21:09:30
"Interview: China's peaceful development beneficial to int'l relations, says expert",https://english.news.cn/20231231/291a15a82c724e4d9176eaab2b16a3b6/c.html,2023-12-31 14:01:45
Xinhua Commentary: South Korea's flirtation with NATO is inviting wolf into its house,https://english.news.cn/20231230/082409b8c4f743fbb801e4564ac75c92/c.html,2023-12-30 16:29:45
U.S. foreign policy depletes wealth of its citizens: American scholar,https://english.news.cn/20231230/a70b0ec682474737a9acbca19585e561/c.html,2023-12-30 15:39:00
Guest Opinion: Quotable views on international relations from 2023,https://english.news.cn/20231230/5d696465531346de8d67aba33ed116f1/c.html,2023-12-30 13:14:15
Xinhua Commentary: Building community with shared future promotes human progress,https://english.news.cn/20231229/1bb37f9068be48ff978dd35153f5f3a4/c.html,2023-12-29 20:38:30
Xinhua Commentary: Washington's speculative charges against China expose hegemonic anxieties,https://english.news.cn/20231229/d81ca1814839415bbe1d2a80e0c94989/c.html,2023-12-29 19:05:29
"Yearender: Ten years on, BRI blazes new path of win-win cooperation for common development  ",https://english.news.cn/20231229/8c658fa0ef2e4d4fab25a056b2d5c46c/c.html,2023-12-29 16:53:06
Guest Opinion: Quotable views on global hotspots from 2023,https://english.news.cn/20231229/df78138c43ee4f199e2578a814e44045/c.html,2023-12-29 16:49:00
