title,link,date
Xinhua Commentary: Exploiting China's goodwill and tolerance leads to nowhere,https://english.news.cn/20240519/6e85fa283f75495b890585bd675eabdc/c.html,2024-05-19 16:59:00
"Xinhua Commentary: U.S. should abandon ""sour grapes"" mentality when China's green products excel",https://english.news.cn/20240519/4b0d01b05b014e7a863e2c38014afa93/c.html,2024-05-19 16:51:30
"Interview: Make friends with Chinese to know real China, U.S. influencer says",https://english.news.cn/20240519/03bf375b9022402689df8dcffcd55271/c.html,2024-05-19 13:08:15
Guest Opinion: Will high tariffs get manufacturing industry back to America?,https://english.news.cn/20240519/312c55a762024e119f7ea809b4fcfedc/c.html,2024-05-19 13:02:30
Xinhua Commentary: Latest U.S. tariffs on China undermine America's green future,https://english.news.cn/20240518/7d4803152c2648f5b0c4b120eea28a4a/c.html,2024-05-18 16:07:17
Guest Opinion: Claims of Chinese overcapacity undermine America's own strengths,https://english.news.cn/20240518/528d80ca37074ed797a84b3e007f66a4/c.html,2024-05-18 14:09:15
Feature: Uffizi exhibition loved by young people in Shanghai,https://english.news.cn/20240518/4805d3390ea646da8174f1b24e635782/c.html,2024-05-18 11:28:30
"Interview: U.S. tariff hikes on Chinese-made EVs hurt global climate agenda, says Ethiopian expert",https://english.news.cn/20240518/99c8e6cfaff0492b9ea4e69cbbca359a/c.html,2024-05-18 10:26:00
"Interview: Chinese, Russian entrepreneurs seek mutually beneficial cooperation, says industry leader",https://english.news.cn/20240517/69647ab50c2b40179ba64cf4829fa496/c.html,2024-05-17 21:07:30
World Insights: Unfounded anxiety over China in Philippines harms people-to-people exchanges,https://english.news.cn/20240517/27ebaa6732ee4143be8360dbc2aa9a51/c.html,2024-05-17 21:07:00
Xinhua Commentary: Washington's tariff ploy inflicts harm with no real benefits,https://english.news.cn/20240517/aee37190626d4ec58128b31dd894d8e9/c.html,2024-05-17 20:51:00
"Interview: Germany-China economic ties not ""one-way street,"" says expert",https://english.news.cn/20240517/87bd87ae66bd4b80a975e92dd8db9be6/c.html,2024-05-17 11:51:45
"Feature: Shanghai, Paris' shared sporting passions strengthen Sino-French connections",https://english.news.cn/20240517/71ff48a9ce6f47899ba90b22bdc0284d/c.html,2024-05-17 08:28:15
Economic Watch: U.S. tariff hikes politicize trade issues: experts,https://english.news.cn/20240516/9e30dc9a51c746a3ab322aeaaa6bd95f/c.html,2024-05-16 20:01:00
World Insights: Are tariff hikes on Chinese EVs a boon for America's green industry?,https://english.news.cn/20240516/5929197ed62745e2b22a883efc2fe444/c.html,2024-05-16 19:25:45
Xinhua Commentary: China's unwavering commitment to high-quality development,https://english.news.cn/20240516/e88edf436f8746b29c70cc3b8c6c95e5/c.html,2024-05-16 17:43:30
Interview: How sport climbing connects the world amid controversy,https://english.news.cn/20240516/39f4436422464cd1910d74d43b352e4b/c.html,2024-05-16 08:55:30
Xinhua Commentary: China's booming new energy industry a boon for the world,https://english.news.cn/20240515/957543fb7a7d402a9524b87258c9160b/c.html,2024-05-15 14:20:30
Feature: Survivors in north Afghanistan floods waiting for aid to recover,https://english.news.cn/20240515/caa3e7d001b84a998520d2f2ca2fa9bd/c.html,2024-05-15 13:47:45
Guest Opinion: China's stabilizing efforts will help calm tensions in the Middle East,https://english.news.cn/20240514/9841e7f6795147c394a1f99d2a36c5cb/c.html,2024-05-14 21:06:00
"Xinhua Commentary: Protectionism will only ""make America lose again""",https://english.news.cn/20240514/59eecd29ddc14a61b884821b11debabe/c.html,2024-05-14 20:18:45
Xinhua Commentary: The power source of China's new energy industry,https://english.news.cn/20240514/8456e7a472924bc3a9406d2d870025d2/c.html,2024-05-14 15:44:30
Feature: London Craft Week kicks off with Chinese craftsmanship under spotlight,https://english.news.cn/20240514/93b6b3ff69ab4ecba23342b4e4fcd5b2/c.html,2024-05-14 10:45:15
Factbox: Inaugural Olympic Qualifier Series in Shanghai,https://english.news.cn/20240513/9c91564ced3b49da925f45538ad141a0/c.html,2024-05-13 15:37:45
"Interview: China's rise an opportunity not threat, says Hungarian official",https://english.news.cn/20240512/dca7de11c6594e038596ac65df4ae88d/c.html,2024-05-12 19:42:30
"Xinhua Headlines: NEV makers move fast in China leveraging innovation, cooperation",https://english.news.cn/20240512/948132ba92dd4f25b1dd1ee5623e51d5/c.html,2024-05-12 18:41:17
News Analysis: China's stronger-than-expected growth bolsters global recovery,https://english.news.cn/20240511/8d15e210c8e14e25b0415e3ad3ab3c43/c.html,2024-05-11 19:52:00
"Interview: To invest in China is to invest in the future, says L'Oreal executive",https://english.news.cn/20240511/a3d193b786e44c45a67fc10c531751c2/c.html,2024-05-11 19:07:16
China In Perspective: Improving key indicators signal positive outlook for China's economy,https://english.news.cn/20240510/9d52207de7bd4385bd0819d86099537b/c.html,2024-05-10 22:16:15
Across China: University collaboration boosts NE China's industrial development,https://english.news.cn/20240510/66c3728f3f364da48e776ccb2d6b8c5f/c.html,2024-05-10 17:46:30
"Interview: China's technology, economic growth to benefit Hungary, says official",https://english.news.cn/20240510/630e4f488752413b8c70936faf7738d8/c.html,2024-05-10 13:35:00
"Column: If the logic of ""overcapacity"" holds, the U.S. is the world's largest ""overcapacity"" country",https://english.news.cn/20240509/cba306705b224c8cb15dc70f052af0ce/c.html,2024-05-09 20:51:15
Interview: China plays key role in race to net zero -- Swiss climate-tech firm CFO,https://english.news.cn/20240508/64c280c3fc5640d8b1d6017c493eb42d/c.html,2024-05-08 12:42:30
Interview: China plays key role in race to net zero -- Swiss climate-tech firm CFO,https://english.news.cn/20240508/e19b39238e964325a2ca61d203636146/c.html,2024-05-08 10:28:15
Xinhua Commentary: Strong spending highlights vitality of China's economy,https://english.news.cn/20240507/fb83aa1a5d4a473389f19d3213bbf78b/c.html,2024-05-07 21:05:45
"Feature: ""French farm to Chinese dining table"" -- a culinary journey strengthening bonds across continents",https://english.news.cn/20240507/7022668581bc4669bcbb5f0c43b4adf3/c.html,2024-05-07 19:52:45
"Interview: Chinese market is ""source of innovation and knowledge,"" says Swiss university scholar",https://english.news.cn/20240507/62e8f825f4e249368d45328b4cad40f3/c.html,2024-05-07 10:15:00
"Interview: Saudi Arabia expects 5 mln Chinese tourists by 2030, says tourism official",https://english.news.cn/20240506/a418c39958924f3989ed42abcc9f0384/c.html,2024-05-06 16:53:15
"Interview: China an important market for multinational companies, says FGS Global CEO",https://english.news.cn/20240506/d652c0bbfca94a39ae720c05bf5ae9b9/c.html,2024-05-06 13:50:30
Xinhua Commentary: China's modernization contributes to building better future for humanity,https://english.news.cn/20240505/14c1cf768c824af3bc2d18e1dd28a5e2/c.html,2024-05-05 18:17:45
"Interview: China, Hungary to strengthen high-quality cooperation under BRI for next decade, says ambassador",https://english.news.cn/20240504/b74a5fb8d36e490cb6876af714478ef2/c.html,2024-05-04 18:55:45
Guest Opinion: The new phase of Serbia-China relations,https://english.news.cn/20240503/ba8cf3d9973646cda75b9f64f42e299b/c.html,2024-05-03 14:06:00
China In Perspective: Optimized payment services deliver tangible convenience for foreigners in China,https://english.news.cn/20240502/39039f86f32642e388817fd82a2e2282/c.html,2024-05-02 12:15:45
Letter from China: Exploring culturally rich Beijing along central axis,https://english.news.cn/20240502/3a3135bbc13f4d9d85d84941670d453e/c.html,2024-05-02 11:53:00
"Interview: Scientists, sci-fi writers explore possibilities of new techs",https://english.news.cn/20240502/d054682d7116400998e587da26ae48ce/c.html,2024-05-02 11:02:45
"Interview: High-tech collaboration a ""flagship"" of Sino-French relations, says Airbus China CFO",https://english.news.cn/20240501/62cf849bae104a4db200c731f6911c25/c.html,2024-05-01 17:02:15
Reinvestigation: Why do major U.S. ratings agencies manipulate Global South's sovereign credit ratings?,https://english.news.cn/20240501/42092d4179ed42eeb9048afc98363953/c.html,2024-05-01 14:02:00
Interview: Saudi historical district expects to cooperate with more Chinese partners: official,https://english.news.cn/20240430/93b7c2ecf80b433ca15dcdf56a826ea2/c.html,2024-04-30 22:05:00
Feature: Displaced women in eastern DRC face sexual abuse amid conflict,https://english.news.cn/20240429/a35769e47f7d46aabf6fe5504a84f627/c.html,2024-04-29 22:11:15
"Interview: China making huge contribution to fight against climate change, says German executive",https://english.news.cn/20240429/c56a00df4eca46db94ae0b00bddfb3e9/c.html,2024-04-29 22:07:45
"Interview: UN official dismisses allegation of ""overcapacity"" in China's green industries as misplaced",https://english.news.cn/20240429/5da6c24636c0406fa4c47d6591f7aa1e/c.html,2024-04-29 16:37:15
"Reinvestigation: Why does the West distort facts to hype so-called ""overcapacity in China""?",https://english.news.cn/20240429/5c7536a8131e4d5088a94d41358f5961/c.html,2024-04-29 15:17:30
Xinhua Commentary: Investing in China is a superior option for multinationals,https://english.news.cn/20240428/8282258b61c84fbd9908f818322de4fb/c.html,2024-04-28 20:43:30
Xinhua Commentary: U.S. police brutality against student protesters exposes hypocrisy on free speech,https://english.news.cn/20240428/94f6d32a892e4a8eb8227359778549ec/c.html,2024-04-28 19:53:30
Letter from China: Feeling pulse of China's tight NEV market from success of newcomer,https://english.news.cn/20240428/cd57f168f2ef4d82ace5c7484fb904cd/c.html,2024-04-28 14:35:15
"Fallacies of the China ""overcapacity"" theory",https://english.news.cn/20240428/4661fde813704825a052934d9042cc4d/c.html,2024-04-28 14:12:08
World Insights: U.S. skyrocketing military spending upsets world,https://english.news.cn/20240428/d143ab58360945dc8dad96768d5512a3/c.html,2024-04-28 11:55:16
Guest Opinion: Who is really betting against America?,https://english.news.cn/20240427/76e60ba8627e4c1b8478a7b9fe6d55ec/c.html,2024-04-27 18:59:15
Xinhua Headlines: Retreat or reinforcement? Decoding foreign investment in China,https://english.news.cn/20240427/9d36ddc5cf64449da0f4b96ee384eea5/c.html,2024-04-27 17:56:31
"Interview: UNECA expects more Chinese, other foreign investments in developing Africa's EV industry",https://english.news.cn/20240427/8f524eccff0f4d5cab7e1241e670c16e/c.html,2024-04-27 15:43:15
"Feature: Read, write and love -- a detective fiction bookshop run by a Chinese detective novelist",https://english.news.cn/20240426/84393f258e6042e3b67e275f8b286e92/c.html,2024-04-26 20:55:00
"Feature: Chinese, American high school students forge friendships through diverse exchanges",https://english.news.cn/20240426/05a54a4aee62473ab9e4c8203d32a4b4/c.html,2024-04-26 20:25:45
"Xinhua Commentary: New energy industry faces undercapacity, not overcapacity",https://english.news.cn/20240425/d80c49d03f564b3389d12758cbbae522/c.html,2024-04-25 18:51:46
Xinhua Commentary: Washington's credibility as a judge on human rights deeply questionable,https://english.news.cn/20240425/07888425baa440a3b40af5ae4a153163/c.html,2024-04-25 13:23:30
(China Economic Roundtable) China In Perspective: China's high-quality development to present opportunities for enterprises,https://english.news.cn/20240425/e5b97197aec94bb0aa99cc877ad13fcc/c.html,2024-04-25 13:19:30
(China Economic Roundtable) Stable growth of China's economy adds certainty to global economic landscape: senior statistics official,https://english.news.cn/20240425/a42015a587a34b14ab9f93ba3e1d8f72/c.html,2024-04-25 13:12:15
Feature: Turkish investors flock to gold amid Middle East turmoils,https://english.news.cn/20240424/d825791a466b4d7bb9395a0efda78b54/c.html,2024-04-24 17:25:00
"Interview: Potential U.S. TikTok ban ""a case of digital protectionism"", says expert",https://english.news.cn/20240424/e8d806c74de04635922391ec8b50a7dd/c.html,2024-04-24 13:13:15
Guest Opinion: Destabilizing South China Sea is U.S. strategic objective,https://english.news.cn/20240422/f408e960a7fa463dae83c6fb71010e4c/c.html,2024-04-22 17:51:30
"Interview: Web Summit in Rio ""thrilled"" about Chinese partners' participation",https://english.news.cn/20240422/db35528c721c434cbcf1648987bddf12/c.html,2024-04-22 09:49:45
"Interview: No second Grand Prix in China, says F1 chief",https://english.news.cn/20240421/45f3fb4e20344d91af085247aca52f9f/c.html,2024-04-21 18:08:30
Interview: U.S. economist says overcapacity argument risks being excuse for protectionism,https://english.news.cn/20240421/ab45e38db1414e84af1d5e807fd169d6/c.html,2024-04-21 16:17:30
Xinhua Commentary: Under professed ideals lies Washington's pursuit of hegemony,https://english.news.cn/20240419/4d4fe8a2e7a340748aca7be88ca38c32/c.html,2024-04-19 17:50:00
China's exports no threat to industries in Global South: Asia Times,https://english.news.cn/20240419/1318f49b0b7a410fb783c23090992d8a/c.html,2024-04-19 12:46:45
Explainer: What you need to know about India's general election,https://english.news.cn/20240419/2c77d7626f0e4f619fae85f0458c3f03/c.html,2024-04-19 10:44:00
"Interview: UN space chief hails ""strong"" cooperation with China",https://english.news.cn/20240418/297d73e0d4ce47ebb77ced9ca8e787e8/c.html,2024-04-18 22:56:00
"Interview: China's industrial capacity eyes global market, says Thai banker",https://english.news.cn/20240418/a7e95358f1c74913b9ef5bba669bcedc/c.html,2024-04-18 13:25:15
"Feature: Downpours, floods add to suffering of impoverished Afghans",https://english.news.cn/20240417/fbe15dde13dd4341806a36688c9e468e/c.html,2024-04-17 15:47:15
"Interview: Ongoing fighting threatens to exacerbate food insecurity in Sudan, says UN official",https://english.news.cn/20240417/d2aab3875ce748258d6b1072c6a3640e/c.html,2024-04-17 11:34:30
Feature: French companies geared up for CIIE 2024,https://english.news.cn/20240417/85f6228d989240bba977c85c3f7ab524/c.html,2024-04-17 06:53:45
"Xinhua Commentary: Resilience, potential, fundamentals of Chinese economy remain sound",https://english.news.cn/20240416/7d6a1a682d7546b1a9fed2a80c4c8fbc/c.html,2024-04-16 18:30:00
Economic Watch: German car parts supplier continues investment in China with confidence,https://english.news.cn/20240415/108265d2e1c34db2a62b742e423c406c/c.html,2024-04-15 17:19:15
Xinhua Commentary: Chinese consumer market full of opportunities for global brands,https://english.news.cn/20240413/bb85ad8113c34a79b23e5ab5959802cb/c.html,2024-04-13 20:36:15
Interview: WTO chief economist sees China as an important driver of global trade,https://english.news.cn/20240413/767296800d9041bb8442de99cfdb6117/c.html,2024-04-13 13:05:15
Interview: Standard Chartered chairman optimistic on China's growth outlook,https://english.news.cn/20240413/cb690884a5394e7fbc6e5ce4d2716cdd/c.html,2024-04-13 08:48:17
Interview: FAO calls for urgent humanitarian access as Sudan's food crisis deepens,https://english.news.cn/20240412/675ef1787ace46528e1992cdbf9e01fc/c.html,2024-04-12 20:25:15
"World Insights: Refusing to take sides, ASEAN insists on impartiality",https://english.news.cn/20240412/bf920fdb96ad4d86902f62afcede9dda/c.html,2024-04-12 18:56:45
Feature: Chinese company lights up hope for Surinamese villages in Amazon rainforest,https://english.news.cn/20240412/54f02d5ee38f494189d96d6fc181c76e/c.html,2024-04-12 10:58:00
"Interview: Chinese solar power project aligns with Suriname's energy strategy, says official",https://english.news.cn/20240412/b624b4559c604e278c76a7aba8fe994f/c.html,2024-04-12 10:45:15
"Interview: Beijing among world's ""super champions"" on Smart City Index -- Swiss expert",https://english.news.cn/20240411/e061e4e443c549b48bc7d9cb16e2690d/c.html,2024-04-11 12:26:30
Xinhua Commentary: Repeated U.S. accusations of Chinese election interference unfounded,https://english.news.cn/20240410/3377393570cc4581b2b71cb6bf8b504a/c.html,2024-04-10 20:54:15
"Interview: Vast potential for cooperation between Suriname, China, says Surinamese president",https://english.news.cn/20240410/08ef94b64072480bb5790cf7c05b7d79/c.html,2024-04-10 18:50:46
Xinhua Commentary: Is there overcapacity in China's EV sector?,https://english.news.cn/20240410/61036f6abaf74f60a9e451cc6d450791/c.html,2024-04-10 18:04:45
World Insights: Intensive China visits by ASEAN officials testament to closer ties,https://english.news.cn/20240409/066ce47077c94d55b7531f779ed504e5/c.html,2024-04-09 14:41:45
Xinhua Commentary: Innovative greening manifests China's environmental preservation drive,https://english.news.cn/20240408/fb71273a060747288ce0abf22a73ebe0/c.html,2024-04-08 20:39:30
"Interview: China-ASEAN economic, trade links inseparable: UOB China executive",https://english.news.cn/20240408/ff7007b339a445c993dba8c0d11dd72d/c.html,2024-04-08 14:51:15
Explainer: What policies are in use to boost China's economic growth,https://english.news.cn/20240408/dbf8273a25854438a9ff8c6d6f29c3df/c.html,2024-04-08 13:00:00
Feature: Surging popularity of Chinese books at Bangkok Int'l Book Fair,https://english.news.cn/20240408/7f6c42a3ad22498c84ca1dc0f1d17ee3/c.html,2024-04-08 11:07:15
Xinhua Commentary: Philippines' provocation undermines regional stability,https://english.news.cn/20240408/ca9107de13f44956998462007c6c3d75/c.html,2024-04-08 10:23:00
Explainer: Why does China-Europe Express Rail expand so fast and become more efficient,https://english.news.cn/20240407/6ecfdc0289c8417f83a0c40b9965cac7/c.html,2024-04-07 13:20:30
"Interview: Sustainability anchor for development in 21st century, says UNGA president",https://english.news.cn/20240407/75c7747a049443b39ad142e8154d0bb4/c.html,2024-04-07 11:41:12
"Xinhua Commentary: Removing barriers good for U.S., China",https://english.news.cn/20240406/c82a235be5604a6a80d8ebf4ebc1d2a1/c.html,2024-04-06 17:11:30
Interview: China's new quality productive forces bring new opportunities for foreign investors,https://english.news.cn/20240406/90ec372f98494dcb9979bf7048081d39/c.html,2024-04-06 15:49:15
Xinhua Commentary: Healthy China-U.S. economic ties require true cooperation over self-interest,https://english.news.cn/20240405/bbafada94f7b4254a97f30eea69a2696/c.html,2024-04-05 20:11:15
Interview: China-Honduras cooperation expanded after a year of diplomatic ties -- Honduran official,https://english.news.cn/20240403/94f92733d6784413a21954d6b77fe24d/c.html,2024-04-03 21:51:00
Interview: Chairman of Volkswagen Group China eyes cooperation to shape new era of individual mobility,https://english.news.cn/20240403/85b65c8f1a80449080866c52c0dfa598/c.html,2024-04-03 21:41:45
Xinhua Commentary: Recovery momentum of Chinese economy strengthened,https://english.news.cn/20240403/08b9a897521a41bc865777d20a818873/c.html,2024-04-03 16:42:30
"Interview: GE Aerospace more committed to China after spin-off, says regional head",https://english.news.cn/20240403/0f6daef4b480465ba3453f5e1acbaf75/c.html,2024-04-03 14:46:30
"Interview: More rate hikes needed to tame Trkiye's inflation, says analyst",https://english.news.cn/20240402/c3de6de459944ff1b677f9b0ed976bbb/c.html,2024-04-02 21:23:15
World Insights: What does Biden's record fundraiser say about the upcoming U.S. election?,https://english.news.cn/20240402/c099a4d7697645a58b878c6be2689862/c.html,2024-04-02 19:25:16
Xinhua Commentary: Overcoming zero-sum mentality for future China-U.S. ties,https://english.news.cn/20240402/6abcc8ee175e422eb9b8e440e4981d39/c.html,2024-04-02 18:23:01
"Interview: China an important promoter of Int'l humanitarian cause, says ICRC senior official",https://english.news.cn/20240401/aef9854377ee41daaf6b1ae2c159331e/c.html,2024-04-01 16:25:15
"Interview: China's development sets example for fast modernization, says Turkish expert",https://english.news.cn/20240401/38240060d6df45bb81f74bbbd7cbd6e3/c.html,2024-04-01 11:57:45
"Xinhua Commentary: China, U.S. need to keep faith with win-win cooperation",https://english.news.cn/20240331/4fe36f935d904aeb8dfc49aca03a2cf4/c.html,2024-03-31 21:42:00
Interview: Chinese EV makers gaining traction in Dutch market: ING economist,https://english.news.cn/20240330/eb1d3537d6134589b653b990166705fd/c.html,2024-03-30 19:37:30
"Interview: China vital for Asia in green growth, innovation, says business leader",https://english.news.cn/20240330/f81f930c93c242c2b8b8cc0c562d6f01/c.html,2024-03-30 11:43:30
"Interview: Trade war with China ""negative for America,"" says Yale scholar",https://english.news.cn/20240330/7f2486ebfcba420892475c55ffd1fcf2/c.html,2024-03-30 11:17:00
Feature: American youths' amazing encounter with Chinese culture,https://english.news.cn/20240329/074cde7443ae4da6b2c369571bfb1258/c.html,2024-03-29 20:04:15
Xinhua Commentary: Embracing the spectrum of democracy in a diverse world,https://english.news.cn/20240329/59b07c1255f943a1906e30f006016cee/c.html,2024-03-29 19:52:31
"Interview: IFRC official says global initiatives put forward by China demonstrate a long-term commitment to multilateral cooperation, development",https://english.news.cn/20240329/16e281b3aaaf49f4bc0fc7c1fcb44ece/c.html,2024-03-29 16:58:15
Xinhua Commentary: Asia's economy promising despite world uncertainties,https://english.news.cn/20240328/b105e262f0394f67b37e786592e6763a/c.html,2024-03-28 20:33:30
"Interview: Theater resonates across cultures, crosses language barriers, says Canadian comedian",https://english.news.cn/20240328/4d11d664bb264fee8a9688e78b491c31/c.html,2024-03-28 17:06:30
"Letter from China: Earth Hour: Lights off, green action on",https://english.news.cn/20240328/d36aa61dac8c45cda8883472e5f8f2e4/c.html,2024-03-28 11:22:47
Letter from China: How multinationals navigate China's dynamic market,https://english.news.cn/20240328/dd549f049c80492f8a05486ffd89d8c7/c.html,2024-03-28 08:52:00
"Interview: China, IPU have collaborated extensively -- IPU president",https://english.news.cn/20240328/7ee7d3b3dce742d9a5b10d9f47890cfb/c.html,2024-03-28 06:58:00
Interview: China's stable economic growth crucial to boosting global economy: Cambodian scholar,https://english.news.cn/20240326/4970a45085bb407fad4813e2b88952e2/c.html,2024-03-26 21:38:00
"Interview: China is Honduras' strategic partner for exports, technological development, says minister",https://english.news.cn/20240326/551b2f418c494e7490adb0e025e290a6/c.html,2024-03-26 15:56:00
Feature: Cuban boxing champion crosses ocean to foster talents in Xinjiang,https://english.news.cn/20240326/0ef06691325848a19daf22ace89b41ba/c.html,2024-03-26 11:16:16
"Xinhua Commentary: Hidden agenda behind hype of China's ""overcapacity problem""",https://english.news.cn/20240325/ae200363dbd843e68571db11ecb45351/c.html,2024-03-25 21:21:15
Interview: AU officials laud China's support to promote health in Africa,https://english.news.cn/20240325/386a7350ca6e4f748936a9599ea95fe1/c.html,2024-03-25 20:56:15
"World Insights: Russia strengthens security, vows to combat terrorism following Moscow concert hall shooting",https://english.news.cn/20240325/be6953b87d1a4831be6ff1b36ae5d85b/c.html,2024-03-25 20:44:45
"Interview: Mercedes-Benz chief sees market potential, long-term opportunities in China",https://english.news.cn/20240325/7fe5ffdab633421db8a97fe3bd9dfc8a/c.html,2024-03-25 19:52:15
"Xinhua Commentary: U.S. ""world leadership"" in the red",https://english.news.cn/20240325/0e318dc638cb4a61b8e043b4b68e929b/c.html,2024-03-25 17:47:30
"World Insights: Rejection of U.S.-proposed draft resolution on Gaza ceasefire highlights its ""increasing global isolation""",https://english.news.cn/20240324/90c712b55b63468db885137b9cfc35a0/c.html,2024-03-24 18:11:30
Feature: Four decades of weather watch atop east China mountain,https://english.news.cn/20240323/f5e38c04613b467496de90f70819ca4d/c.html,2024-03-23 16:00:46
Interview: Dominican PM views China as all-weather friend,https://english.news.cn/20240322/dc5c7841623e4dd68355ee01eec80fc7/c.html,2024-03-22 21:10:00
Feature: China-Thailand cooperation on electric taxis transforming Thai largest airport,https://english.news.cn/20240322/f23f51427cc04bb295c15dcf1a826f21/c.html,2024-03-22 20:09:30
Letter from China: Chinese sports industry poised to flourish as fitness passion grows,https://english.news.cn/20240322/9890dfbdee3e4623a82c67cd4422062f/c.html,2024-03-22 19:05:45
Feature: Perseverance - the power of Chinese future women's basketball star,https://english.news.cn/20240322/e5aac45002ac4b66b8bb7f52e330823c/c.html,2024-03-22 09:48:00
Guest Opinion: China's new quality productive forces: a force for good,https://english.news.cn/20240321/76815d516034405583e97c34dee00c5b/c.html,2024-03-21 19:44:45
"Global governance reform needs equal, open dialogue between West, Global South: expert",https://english.news.cn/20240321/b4fd7bcbc4e740d8a175fdcfaec9f693/c.html,2024-03-21 15:40:30
Economic Watch: Western oil giants look at new strategy amid global energy transition,https://english.news.cn/20240319/d7ddfa1b5b604b528444ad26e4e9fdd5/c.html,2024-03-19 19:59:30
Feature: China's technological support transforms higher education in Pakistan,https://english.news.cn/20240319/f9c309c722674ace83b8de228020cb76/c.html,2024-03-19 19:10:45
"Xinhua Commentary: Washington's exploiting claims of ""national security"" threatens global prosperity",https://english.news.cn/20240318/2a4248c81fed4a5fa91c6d8e386f70e6/c.html,2024-03-18 21:50:00
"Xinhua Commentary: The ""Summit for Democracy"" -- An exercise in contradiction?",https://english.news.cn/20240318/5084e3b42e9f446f82bd505eeac45fdf/c.html,2024-03-18 20:02:30
Xinhua Commentary: Washington's stubborn pursuit of camp confrontation in a multi-polar world,https://english.news.cn/20240318/c759d18f7d0f40968463e377ddb3fdd0/c.html,2024-03-18 16:25:45
